{
  "schemaVersion": "1.0",
  "status": "GROUNDED",
  "answer": "The standard reimbursement window is 30 days [K1].",
  "citations": [
    {
      "marker": "[K1]",
      "indexVersion": "finance-index@1.0.0",
      "sourceId": "11111111-1111-4111-8111-111111111111",
      "sourceRevisionId": "22222222-2222-4222-8222-222222222222",
      "documentId": "33333333-3333-4333-8333-333333333333",
      "chunkId": "44444444-4444-4444-8444-444444444444",
      "contentDigest": "sha256:aaaaaaaaaaaaaaaaaaaaaaaaaaaaaaaaaaaaaaaaaaaaaaaaaaaaaaaaaaaaaaaa",
      "rank": 1,
      "score": 0.91,
      "sourceTitle": "Expense policy",
      "sourceType": "PDF",
      "page": 4,
      "heading": "Submission deadline",
      "paragraph": 2,
      "lineStart": null,
      "lineEnd": null,
      "locator": "/api/v1/knowledge-source-revisions/22222222-2222-4222-8222-222222222222/content#page=4"
    }
  ]
}
